{
  "schema_version": "0.1.0",
  "candidate_id": "CAND-SUPPORT-2026-07-31",
  "artifact_status": "final",
  "risks": [
    {"risk_id": "RISK-DISCLOSURE", "statement": "Incorrect retrieval authorization could expose another tenant's confidential support record.", "category": "security", "owner_actor_id": "ACT-SYSTEM", "inherent_risk_level": "critical", "treatment": "mitigate", "control_ids": ["CTRL-TENANT"], "status": "treated", "residual_risk_level": "moderate", "rationale": "Caller-scoped filtering and cross-tenant boundary tests reduce but do not eliminate implementation and configuration risk.", "acceptance": {"actor_id": "ACT-SYSTEM", "role": "risk_manager", "accepted_at": "2026-07-31T10:30:00Z", "expires_at": "2026-10-28T10:00:00Z", "rationale": "The verified controls and bounded internal use reduce this fictional residual risk to the approved moderate tolerance."}},
    {"risk_id": "RISK-INJECTION", "statement": "Instructions embedded in an authorized document could alter behavior or cause disclosure through generated links.", "category": "security", "owner_actor_id": "ACT-SYSTEM", "inherent_risk_level": "high", "treatment": "mitigate", "control_ids": ["CTRL-INJECTION"], "status": "treated", "residual_risk_level": "moderate", "rationale": "The assistant has no external tools, link fetching is disabled, and layered attack tests passed in the fictional evidence.", "acceptance": {"actor_id": "ACT-SYSTEM", "role": "risk_manager", "accepted_at": "2026-07-31T10:30:00Z", "expires_at": "2026-10-28T11:00:00Z", "rationale": "The passing remediation retest and layered controls support fictional acceptance within the approved moderate tolerance."}},
    {"risk_id": "RISK-UNSUPPORTED", "statement": "An unsupported policy answer could mislead an employee about an internal support process.", "category": "quality", "owner_actor_id": "ACT-SYSTEM", "inherent_risk_level": "high", "treatment": "mitigate", "control_ids": ["CTRL-QUALITY"], "status": "treated", "residual_risk_level": "moderate", "rationale": "Citations, abstention cases, model-grader validation, and human escalation bound the remaining probabilistic error.", "acceptance": {"actor_id": "ACT-SYSTEM", "role": "risk_manager", "accepted_at": "2026-07-31T10:30:00Z", "expires_at": "2026-09-13T12:00:00Z", "rationale": "The abstention and escalation controls bound this fictional residual risk within the approved moderate tolerance."}},
    {"risk_id": "RISK-PRIVACY", "statement": "Prompts, retrieved content, evaluation traces, or event records could retain unnecessary personal data.", "category": "privacy", "owner_actor_id": "ACT-SYSTEM", "inherent_risk_level": "high", "treatment": "mitigate", "control_ids": ["CTRL-PRIVACY"], "status": "treated", "residual_risk_level": "low", "rationale": "Purpose limitation, synthetic test data, minimized event fields, restricted access, and deletion controls are verified in the fictional assessment.", "acceptance": {"actor_id": "ACT-SYSTEM", "role": "system_owner", "accepted_at": "2026-07-31T10:30:00Z", "expires_at": "2026-10-29T10:30:00Z", "rationale": "Verified minimization and deletion controls support fictional acceptance of the remaining low privacy risk."}},
    {"risk_id": "RISK-AVAILABILITY", "statement": "Large or repeated requests could exhaust model capacity or create uncontrolled cost and latency.", "category": "operational", "owner_actor_id": "ACT-SYSTEM", "inherent_risk_level": "moderate", "treatment": "mitigate", "control_ids": ["CTRL-RESOURCE"], "status": "treated", "residual_risk_level": "low", "rationale": "Input, output, concurrency, timeout, and cost limits passed fictional boundary tests and are monitored.", "acceptance": {"actor_id": "ACT-SYSTEM", "role": "system_owner", "accepted_at": "2026-07-31T10:30:00Z", "expires_at": "2026-10-28T10:00:00Z", "rationale": "Verified limits and monitoring support fictional acceptance of the remaining low operational risk."}}
  ]
}
